<?xml version="1.0" encoding="UTF-8"?>
<persistence-history
    xmlns="http://lazydog.org/xml/ns/persistence-history"
    xmlns:xsi="http://www.w3.org/2001/XMLSchema-instance"
    xsi:schemaLocation="http://lazydog.org/xml/ns/persistence-history
                        http://lazydog.org/xml/ns/persistence-history/persistence-history.xsd">

    <table-data-source>jdbc/ComicPool</table-data-source>
    <history-table-data-source>jdbc/ComicHistoryPool</history-table-data-source>
    <history-table-suffix>_audit</history-table-suffix>
    <entity class="org.lazydog.comic.model.Category"/>
    <entity class="org.lazydog.comic.model.Character">
        <table id="id"/>
    </entity>
    <entity class="org.lazydog.comic.model.Comic">
        <table name="comic_test"/>
    </entity>
    <entity class="org.lazydog.comic.model.ComicType">
        <table name="comic_type_test" id="id"/>
        <history-table name="comic_type_test_history" id="history_id"/>
    </entity>
    <entity class="org.lazydog.comic.model.Title">
        <table name="title_test"/>
        <history-table name="title_test_history"/>
    </entity>
</persistence-history>
